{
  "id": "project-risk-management",
  "title": "项目风险管理实战指南",
  "excerpt": "详细介绍项目风险管理的方法、工具和最佳实践",
  "publishedAt": "2025-08-04T00:00:00.000Z",
  "tags": [
    "风险管理",
    "项目管理",
    "实战指南"
  ],
  "slug": "project-risk-management",
  "readingTime": 6,
  "folder": "项目管理",
  "filePath": "项目管理/项目风险管理实战指南.md",
  "content": "\n# 项目风险管理实战指南\n\n## 风险管理流程\n\n### 1. 规划风险管理\n- 制定风险管理计划\n- 确定风险管理方法\n- 定义风险分类标准\n- 建立风险阈值\n\n### 2. 识别风险\n- 文档审查\n- 头脑风暴\n- 德尔菲技术\n- 访谈\n- 核对单分析\n\n### 3. 实施定性风险分析\n- 评估风险概率\n- 评估风险影响\n- 使用概率影响矩阵\n- 确定风险优先级\n\n### 4. 实施定量风险分析\n- 敏感性分析\n- 预期货币价值分析\n- 建模和模拟\n- 决策树分析\n\n### 5. 规划风险应对\n- 消极风险应对策略\n- 积极风险应对策略\n- 制定应对计划\n- 准备应急措施\n\n### 6. 实施风险应对\n- 执行风险应对\n- 监控应对效果\n- 调整应对策略\n- 记录应对结果\n\n### 7. 监督风险\n- 跟踪已识别风险\n- 监控残余风险\n- 识别新风险\n- 执行风险应对计划\n\n## 风险分类\n\n### 技术风险\n- 技术不确定性\n- 技术复杂性\n- 技术依赖性\n- 技术过时\n\n### 管理风险\n- 计划不充分\n- 资源不足\n- 沟通不畅\n- 控制不力\n\n### 商业风险\n- 市场变化\n- 竞争压力\n- 客户需求变化\n- 商业环境变化\n\n### 外部风险\n- 法律法规变化\n- 自然灾害\n- 政治环境变化\n- 经济环境变化\n\n## 风险应对策略\n\n### 消极风险应对\n- **规避**：消除风险或保护项目免受风险影响\n- **转移**：将风险转移给第三方\n- **减轻**：降低风险概率或影响\n- **接受**：承认风险存在，不采取行动\n\n### 积极风险应对\n- **开拓**：确保机会实现\n- **分享**：与第三方分享机会\n- **提高**：增加机会概率或影响\n- **接受**：当机会出现时利用\n\n## 风险管理工具\n\n### 风险登记册\n- 风险ID和描述\n- 风险类别和概率\n- 风险影响和应对策略\n- 责任人和状态\n\n### 分析工具\n- SWOT分析\n- PEST分析\n- 利益相关者分析\n- 根本原因分析\n\n## 最佳实践\n\n### 早期识别\n- 在项目启动阶段开始风险管理\n- 建立风险识别机制\n- 鼓励团队参与风险识别\n\n### 持续监控\n- 建立风险监控体系\n- 定期进行风险审查\n- 及时更新风险状态\n\n### 团队参与\n- 全员参与风险管理\n- 建立风险意识\n- 提供风险管理培训\n\n## 总结\n\n有效的风险管理可以提高项目成功率，降低项目成本，确保项目质量。需要系统性思维、预防性思维和持续性思维。",
  "rawContent": "---\ntitle: 项目风险管理实战指南\nexcerpt: 详细介绍项目风险管理的方法、工具和最佳实践\npublishedAt: 2025-08-04\ntags: [风险管理, 项目管理, 实战指南]\nslug: project-risk-management\nreadingTime: 6\n---\n\n# 项目风险管理实战指南\n\n## 风险管理流程\n\n### 1. 规划风险管理\n- 制定风险管理计划\n- 确定风险管理方法\n- 定义风险分类标准\n- 建立风险阈值\n\n### 2. 识别风险\n- 文档审查\n- 头脑风暴\n- 德尔菲技术\n- 访谈\n- 核对单分析\n\n### 3. 实施定性风险分析\n- 评估风险概率\n- 评估风险影响\n- 使用概率影响矩阵\n- 确定风险优先级\n\n### 4. 实施定量风险分析\n- 敏感性分析\n- 预期货币价值分析\n- 建模和模拟\n- 决策树分析\n\n### 5. 规划风险应对\n- 消极风险应对策略\n- 积极风险应对策略\n- 制定应对计划\n- 准备应急措施\n\n### 6. 实施风险应对\n- 执行风险应对\n- 监控应对效果\n- 调整应对策略\n- 记录应对结果\n\n### 7. 监督风险\n- 跟踪已识别风险\n- 监控残余风险\n- 识别新风险\n- 执行风险应对计划\n\n## 风险分类\n\n### 技术风险\n- 技术不确定性\n- 技术复杂性\n- 技术依赖性\n- 技术过时\n\n### 管理风险\n- 计划不充分\n- 资源不足\n- 沟通不畅\n- 控制不力\n\n### 商业风险\n- 市场变化\n- 竞争压力\n- 客户需求变化\n- 商业环境变化\n\n### 外部风险\n- 法律法规变化\n- 自然灾害\n- 政治环境变化\n- 经济环境变化\n\n## 风险应对策略\n\n### 消极风险应对\n- **规避**：消除风险或保护项目免受风险影响\n- **转移**：将风险转移给第三方\n- **减轻**：降低风险概率或影响\n- **接受**：承认风险存在，不采取行动\n\n### 积极风险应对\n- **开拓**：确保机会实现\n- **分享**：与第三方分享机会\n- **提高**：增加机会概率或影响\n- **接受**：当机会出现时利用\n\n## 风险管理工具\n\n### 风险登记册\n- 风险ID和描述\n- 风险类别和概率\n- 风险影响和应对策略\n- 责任人和状态\n\n### 分析工具\n- SWOT分析\n- PEST分析\n- 利益相关者分析\n- 根本原因分析\n\n## 最佳实践\n\n### 早期识别\n- 在项目启动阶段开始风险管理\n- 建立风险识别机制\n- 鼓励团队参与风险识别\n\n### 持续监控\n- 建立风险监控体系\n- 定期进行风险审查\n- 及时更新风险状态\n\n### 团队参与\n- 全员参与风险管理\n- 建立风险意识\n- 提供风险管理培训\n\n## 总结\n\n有效的风险管理可以提高项目成功率，降低项目成本，确保项目质量。需要系统性思维、预防性思维和持续性思维。"
}