{
  "id": "project-management-core-knowledge",
  "title": "项目管理核心知识点",
  "excerpt": "详细介绍项目管理需要掌握的核心知识体系，包括十大知识领域和现代项目管理方法",
  "publishedAt": "2025-08-04T00:00:00.000Z",
  "tags": [
    "项目管理",
    "知识体系",
    "十大管理"
  ],
  "slug": "project-management-core-knowledge",
  "readingTime": 5,
  "folder": "项目管理",
  "filePath": "项目管理/项目管理核心知识点.md",
  "content": "\n# 项目管理核心知识点\n\n## 项目管理概述\n\n项目管理是一门综合性的管理学科，涉及计划、组织、指导和控制项目活动，以实现项目目标。\n\n## 十大知识领域\n\n### 1. 项目整合管理\n- 制定项目章程\n- 制定项目管理计划\n- 指导与管理项目工作\n- 监控项目工作\n- 实施整体变更控制\n- 结束项目或阶段\n\n### 2. 项目范围管理\n- 规划范围管理\n- 收集需求\n- 定义范围\n- 创建工作分解结构\n- 确认范围\n- 控制范围\n\n### 3. 项目进度管理\n- 规划进度管理\n- 定义活动\n- 排列活动顺序\n- 估算活动持续时间\n- 制定进度计划\n- 控制进度\n\n### 4. 项目成本管理\n- 规划成本管理\n- 估算成本\n- 制定预算\n- 控制成本\n\n### 5. 项目质量管理\n- 规划质量管理\n- 管理质量\n- 控制质量\n\n### 6. 项目资源管理\n- 规划资源管理\n- 估算活动资源\n- 获取资源\n- 建设团队\n- 管理团队\n- 控制资源\n\n### 7. 项目沟通管理\n- 规划沟通管理\n- 管理沟通\n- 监督沟通\n\n### 8. 项目风险管理\n- 规划风险管理\n- 识别风险\n- 实施定性风险分析\n- 实施定量风险分析\n- 规划风险应对\n- 实施风险应对\n- 监督风险\n\n### 9. 项目采购管理\n- 规划采购管理\n- 实施采购\n- 控制采购\n\n### 10. 项目相关方管理\n- 识别相关方\n- 规划相关方参与\n- 管理相关方参与\n- 监督相关方参与\n\n## 现代项目管理方法\n\n### 敏捷项目管理\n- Scrum框架\n- 看板方法\n- 极限编程\n\n### 精益项目管理\n- 消除浪费\n- 价值流映射\n- 持续改进\n\n## 总结\n\n项目管理需要掌握完整的知识体系，包括传统的十大知识领域和现代敏捷方法。通过系统学习和实践，可以提高项目成功率。",
  "rawContent": "---\ntitle: 项目管理核心知识点\nexcerpt: 详细介绍项目管理需要掌握的核心知识体系，包括十大知识领域和现代项目管理方法\npublishedAt: 2025-08-04\ntags: [项目管理, 知识体系, 十大管理]\nslug: project-management-core-knowledge\nreadingTime: 5\n---\n\n# 项目管理核心知识点\n\n## 项目管理概述\n\n项目管理是一门综合性的管理学科，涉及计划、组织、指导和控制项目活动，以实现项目目标。\n\n## 十大知识领域\n\n### 1. 项目整合管理\n- 制定项目章程\n- 制定项目管理计划\n- 指导与管理项目工作\n- 监控项目工作\n- 实施整体变更控制\n- 结束项目或阶段\n\n### 2. 项目范围管理\n- 规划范围管理\n- 收集需求\n- 定义范围\n- 创建工作分解结构\n- 确认范围\n- 控制范围\n\n### 3. 项目进度管理\n- 规划进度管理\n- 定义活动\n- 排列活动顺序\n- 估算活动持续时间\n- 制定进度计划\n- 控制进度\n\n### 4. 项目成本管理\n- 规划成本管理\n- 估算成本\n- 制定预算\n- 控制成本\n\n### 5. 项目质量管理\n- 规划质量管理\n- 管理质量\n- 控制质量\n\n### 6. 项目资源管理\n- 规划资源管理\n- 估算活动资源\n- 获取资源\n- 建设团队\n- 管理团队\n- 控制资源\n\n### 7. 项目沟通管理\n- 规划沟通管理\n- 管理沟通\n- 监督沟通\n\n### 8. 项目风险管理\n- 规划风险管理\n- 识别风险\n- 实施定性风险分析\n- 实施定量风险分析\n- 规划风险应对\n- 实施风险应对\n- 监督风险\n\n### 9. 项目采购管理\n- 规划采购管理\n- 实施采购\n- 控制采购\n\n### 10. 项目相关方管理\n- 识别相关方\n- 规划相关方参与\n- 管理相关方参与\n- 监督相关方参与\n\n## 现代项目管理方法\n\n### 敏捷项目管理\n- Scrum框架\n- 看板方法\n- 极限编程\n\n### 精益项目管理\n- 消除浪费\n- 价值流映射\n- 持续改进\n\n## 总结\n\n项目管理需要掌握完整的知识体系，包括传统的十大知识领域和现代敏捷方法。通过系统学习和实践，可以提高项目成功率。"
}